{
  "$schema": "../../tools/validate/flatpack.schema.json",
  "format": 1,
  "identity": {
    "product": "SÖMNLÖS",
    "maker": "SKRUV",
    "documentCode": "SK-0000454-1",
    "category": "Bed frame",
    "variants": [
      {
        "name": "White",
        "color": "partPanel",
        "article": "454.000.01"
      },
      {
        "name": "Black-brown",
        "color": "partPanelBlackBrown",
        "article": "454.000.02"
      }
    ]
  },
  "vocabulary": {
    "connectors": ["dowelHole", "camBoltHole", "camLockRecess", "shelfPinHole", "screwHole", "screwPilot", "dowelEnd", "boltThread", "hexSocket", "camLockBody", "pinTip", "screwThread", "wrenchTip", "driveSlot", "screwdriverTip"],
    "fasteners": ["dowel", "pin", "bolt", "cam", "screw", "tool"]
  },
  "parts": {
    "sideRail": {
      "partNumber": "40101",
      "box": [0.04, 0.38, 2.08],
      "mass": 9,
      "color": "partPanel",
      "quantity": 2,
      "connectors": [
        {
          "id": "dowelHole-1",
          "type": "dowelHole",
          "position": [0.02, -0.1, -1.02],
          "axis": [1, 0, 0]
        },
        {
          "id": "dowelHole-2",
          "type": "dowelHole",
          "position": [0.02, 0.1, -1.02],
          "axis": [1, 0, 0]
        },
        {
          "id": "dowelHole-3",
          "type": "dowelHole",
          "position": [0.02, -0.1, 1.02],
          "axis": [1, 0, 0]
        },
        {
          "id": "dowelHole-4",
          "type": "dowelHole",
          "position": [0.02, 0.1, 1.02],
          "axis": [1, 0, 0]
        },
        {
          "id": "camBoltHole-1",
          "type": "camBoltHole",
          "position": [0.02, -0.04, -1.006],
          "axis": [1, 0, 0]
        },
        {
          "id": "camBoltHole-2",
          "type": "camBoltHole",
          "position": [0.02, 0.04, -1.006],
          "axis": [1, 0, 0]
        },
        {
          "id": "camBoltHole-3",
          "type": "camBoltHole",
          "position": [0.02, -0.04, 1.006],
          "axis": [1, 0, 0]
        },
        {
          "id": "camBoltHole-4",
          "type": "camBoltHole",
          "position": [0.02, 0.04, 1.006],
          "axis": [1, 0, 0]
        },
        {
          "id": "shelfPinHole-1",
          "type": "shelfPinHole",
          "position": [0.0, 0.19, -0.845],
          "axis": [0, 1, 0]
        },
        {
          "id": "shelfPinHole-2",
          "type": "shelfPinHole",
          "position": [0.0, 0.19, 0.065],
          "axis": [0, 1, 0]
        },
        {
          "id": "shelfPinHole-3",
          "type": "shelfPinHole",
          "position": [0.0, 0.19, 0.845],
          "axis": [0, 1, 0]
        }
      ]
    },
    "headboard": {
      "partNumber": "40102",
      "box": [1.52, 0.98, 0.04],
      "mass": 14,
      "color": "partPanel",
      "quantity": 1,
      "connectors": [
        {
          "id": "dowelHole-1",
          "type": "dowelHole",
          "position": [-0.76, -0.4, 0.0],
          "axis": [-1, 0, 0]
        },
        {
          "id": "dowelHole-2",
          "type": "dowelHole",
          "position": [-0.76, -0.2, 0.0],
          "axis": [-1, 0, 0]
        },
        {
          "id": "dowelHole-3",
          "type": "dowelHole",
          "position": [0.76, -0.4, 0.0],
          "axis": [1, 0, 0]
        },
        {
          "id": "dowelHole-4",
          "type": "dowelHole",
          "position": [0.76, -0.2, 0.0],
          "axis": [1, 0, 0]
        },
        {
          "id": "camLockRecess-1",
          "type": "camLockRecess",
          "position": [-0.726, -0.34, 0.02],
          "axis": [0, 0, 1]
        },
        {
          "id": "camLockRecess-2",
          "type": "camLockRecess",
          "position": [-0.726, -0.26, 0.02],
          "axis": [0, 0, 1]
        },
        {
          "id": "camLockRecess-3",
          "type": "camLockRecess",
          "position": [0.726, -0.34, 0.02],
          "axis": [0, 0, 1]
        },
        {
          "id": "camLockRecess-4",
          "type": "camLockRecess",
          "position": [0.726, -0.26, 0.02],
          "axis": [0, 0, 1]
        },
        {
          "id": "dowelHole-5",
          "type": "dowelHole",
          "position": [-0.012, -0.15, 0.02],
          "axis": [0, 0, 1]
        },
        {
          "id": "dowelHole-6",
          "type": "dowelHole",
          "position": [0.012, -0.15, 0.02],
          "axis": [0, 0, 1]
        }
      ]
    },
    "footboard": {
      "partNumber": "40103",
      "box": [1.52, 0.38, 0.04],
      "mass": 6,
      "color": "partPanel",
      "quantity": 1,
      "connectors": [
        {
          "id": "dowelHole-1",
          "type": "dowelHole",
          "position": [-0.76, -0.1, 0.0],
          "axis": [-1, 0, 0]
        },
        {
          "id": "dowelHole-2",
          "type": "dowelHole",
          "position": [-0.76, 0.1, 0.0],
          "axis": [-1, 0, 0]
        },
        {
          "id": "dowelHole-3",
          "type": "dowelHole",
          "position": [0.76, -0.1, 0.0],
          "axis": [1, 0, 0]
        },
        {
          "id": "dowelHole-4",
          "type": "dowelHole",
          "position": [0.76, 0.1, 0.0],
          "axis": [1, 0, 0]
        },
        {
          "id": "camLockRecess-1",
          "type": "camLockRecess",
          "position": [-0.726, -0.04, -0.02],
          "axis": [0, 0, -1]
        },
        {
          "id": "camLockRecess-2",
          "type": "camLockRecess",
          "position": [-0.726, 0.04, -0.02],
          "axis": [0, 0, -1]
        },
        {
          "id": "camLockRecess-3",
          "type": "camLockRecess",
          "position": [0.726, -0.04, -0.02],
          "axis": [0, 0, -1]
        },
        {
          "id": "camLockRecess-4",
          "type": "camLockRecess",
          "position": [0.726, 0.04, -0.02],
          "axis": [0, 0, -1]
        },
        {
          "id": "dowelHole-5",
          "type": "dowelHole",
          "position": [-0.012, 0.15, -0.02],
          "axis": [0, 0, -1]
        },
        {
          "id": "dowelHole-6",
          "type": "dowelHole",
          "position": [0.012, 0.15, -0.02],
          "axis": [0, 0, -1]
        }
      ]
    },
    "beam": {
      "partNumber": "40104",
      "box": [0.04, 0.08, 2.0],
      "mass": 2.5,
      "color": "partPanel",
      "quantity": 1,
      "connectors": [
        {
          "id": "dowelHole-1",
          "type": "dowelHole",
          "position": [-0.012, 0.0, -1.0],
          "axis": [0, 0, -1]
        },
        {
          "id": "dowelHole-2",
          "type": "dowelHole",
          "position": [0.012, 0.0, -1.0],
          "axis": [0, 0, -1]
        },
        {
          "id": "dowelHole-3",
          "type": "dowelHole",
          "position": [-0.012, 0.0, 1.0],
          "axis": [0, 0, 1]
        },
        {
          "id": "dowelHole-4",
          "type": "dowelHole",
          "position": [0.012, 0.0, 1.0],
          "axis": [0, 0, 1]
        },
        {
          "id": "screwPilot-1",
          "type": "screwPilot",
          "position": [0.02, 0.0, -0.525],
          "axis": [1, 0, 0]
        },
        {
          "id": "screwPilot-2",
          "type": "screwPilot",
          "position": [0.02, 0.0, -0.475],
          "axis": [1, 0, 0]
        },
        {
          "id": "screwPilot-3",
          "type": "screwPilot",
          "position": [0.02, 0.0, 0.475],
          "axis": [1, 0, 0]
        },
        {
          "id": "screwPilot-4",
          "type": "screwPilot",
          "position": [0.02, 0.0, 0.525],
          "axis": [1, 0, 0]
        }
      ]
    },
    "leg": {
      "partNumber": "40105",
      "box": [0.012, 0.38, 0.08],
      "mass": 0.4,
      "color": "partPanel",
      "quantity": 2,
      "connectors": [
        {
          "id": "screwHole-1",
          "type": "screwHole",
          "position": [0.006, 0.15, -0.025],
          "axis": [1, 0, 0]
        },
        {
          "id": "screwHole-2",
          "type": "screwHole",
          "position": [0.006, 0.15, 0.025],
          "axis": [1, 0, 0]
        }
      ]
    },
    "slat": {
      "partNumber": "40106",
      "box": [1.6, 0.016, 0.08],
      "mass": 1,
      "color": "partDowel",
      "quantity": 15,
      "connectors": []
    },
    "glide": {
      "partNumber": "40201",
      "box": [0.03, 0.016, 0.012],
      "mass": 0.004,
      "color": "partFitting",
      "quantity": 6,
      "connectors": [
        {
          "id": "pinTip-1",
          "type": "pinTip",
          "position": [0.0, -0.008, 0.0],
          "axis": [0, -1, 0]
        }
      ]
    },
    "dowel": {
      "partNumber": "40301",
      "box": [0.008, 0.03, 0.008],
      "mass": 0.0015,
      "color": "partDowel",
      "quantity": 12,
      "spares": 2,
      "connectors": [
        {
          "id": "dowelEnd-1",
          "type": "dowelEnd",
          "position": [0.0, -0.015, 0.0],
          "axis": [0, -1, 0]
        },
        {
          "id": "dowelEnd-2",
          "type": "dowelEnd",
          "position": [0.0, 0.015, 0.0],
          "axis": [0, 1, 0]
        }
      ]
    },
    "camLockBolt": {
      "partNumber": "40302",
      "box": [0.007, 0.035, 0.007],
      "mass": 0.004,
      "color": "partMetal",
      "quantity": 8,
      "connectors": [
        {
          "id": "boltThread-1",
          "type": "boltThread",
          "position": [0.0, -0.0175, 0.0],
          "axis": [0, -1, 0]
        },
        {
          "id": "hexSocket-1",
          "type": "hexSocket",
          "position": [0.0, 0.0175, 0.0],
          "axis": [0, 1, 0]
        }
      ]
    },
    "camLock": {
      "partNumber": "40303",
      "box": [0.015, 0.012, 0.015],
      "mass": 0.005,
      "color": "partMetal",
      "quantity": 8,
      "spares": 1,
      "connectors": [
        {
          "id": "camLockBody-1",
          "type": "camLockBody",
          "position": [0.0, -0.006, 0.0],
          "axis": [0, -1, 0]
        },